startup_0221e174296,You know when you forward a filmy meme most of the time Filmygyan is mostly behind them. They are one innovative set of people making our lives masaledaar!,"You know when you forward a filmy meme most of the time Filmygyan is mostly behind them. They are one innovative set of people making our lives masaledaar! Bollywood Review, movie review, entertainment, meme.",8,7,9,12,Ecommerce
startup_049027ac21d,"Providing solutions in Banking, Software and many more. Sumeru is your go to organisation for IT solutions with a human touch.

","Providing solutions in Banking, Software and many more. Sumeru is your go to organisation for IT solutions with a human touch. Banking, Software, IT.

",6,6,6,11,Blockchain
startup_07b7f23419d,"Mobiefit motivates you to get fitter, healthier and a happier person with workouts, running and walking training. It enables its users to access training videos and exercises for a 'fitter you'!","Mobiefit motivates you to get fitter, healthier and a happier person with workouts, running and walking training. It enables its users to access training videos and exercises for a 'fitter you'! Fit, Fitness, walking, running, workout, training, health.",6,5,9,13,Food catering
startup_08971b04e3a,A fun-filled space with high - class technological games to entertain youngsters and adults equally!,"A fun-filled space with high - class technological games to entertain youngsters and adults equally! Tehnology, youngsters, fun, Entertainment, games.",9,8,7,16,Entertainment
startup_128f4e34887,"Hipcask is a smartphone application that enables users to discover wines, whiskies, and beers. The application enables users to measure a likability factor, pair wines with foods, get and add tasting notes, get notifications about new launches, and more.","Hipcask is a smartphone application that enables users to discover wines, whiskies, and beers. The application enables users to measure a likability factor, pair wines with foods, get and add tasting notes, get notifications about new launches, and more. Sommelier, Food critic",9,7,8,13,Banking
startup_129b01b099e,"ftcash is one of IndiaÍs fast-growing financial technology venture, recognized by Forbes, which aims to empower micro-merchants and small businesses with the power of credit using digital payments, using only a bank account and a feature phone","ftcash is one of IndiaÍs fast-growing financial technology venture, recognized by Forbes, which aims to empower micro-merchants and small businesses with the power of credit using digital payments, using only a bank account and a feature phone. Payment, Transaction, small scale, cashless, digital.",9,9,7,10,Consultancy
startup_1c057cbeac3,Known as Indian's most trusted pharmacy Netmeds.com is a renowned name in the medical field. It enables the user to send or receive medicine from any part of India.,Known as Indian's most trusted pharmacy Netmeds.com is a renowned name in the medical field. It enables the user to send or receive medicine from any part of India. Medical,6,8,5,13,Interior decorators
startup_1e2a7dc8110,OncoStem Diagnostics was founded in 2011 with the vision of developing innovative multimarker prognostic & predictive tests to enable personalized treatment planning for patients with Cancer.,"OncoStem Diagnostics was founded in 2011 with the vision of developing innovative multimarker prognostic & predictive tests to enable personalized treatment planning for patients with Cancer. Health, Checkup, diagnostic test, Cancer treatment, treat.",4,4,6,15,Wedding planners
startup_258b66dcf51,"Seeing that Artificial Intelligence is the future, Boxx.ai uses the same technology to solve problems that enterprises face in a more affordable way, making it more accessible for all. With all this securing a place amongst the top startups in India","Seeing that Artificial Intelligence is the future, Boxx.ai uses the same technology to solve problems that enterprises face in a more affordable way, making it more accessible for all. With all this securing a place amongst the top startups in India. Top startups, AI, technology",4,8,9,13,VR
startup_2f4aa8e859b,HexOctane is an Internet of Things company intending toæcreate an environment which fosters ease of access to relevant information just when you need it and thus bring to life an informed sixth sense that manifests itself through one's smartphone.,"HexOctane is an Internet of Things company intending toæcreate an environment which fosters ease of access to relevant information just when you need it and thus bring to life an informed sixth sense that manifests itself through one's smartphone. access, relevant, data, message, IoT, environment.",5,5,5,12,Education
startup_30cf33991de,"Making finger - licking homely food, Fingerlix aims on being 'the food' for travelling professionals and fill stomachs of people with tasty food.","Making finger - licking homely food, Fingerlix aims on being 'the food' for travelling professionals and fill stomachs of people with tasty food. yummy, tasty, delicious, amazing food, fingerlix, travel, transport food.",6,2,4,11,Movers and takers
startup_35e0b47ed5f,With a sole aim of connecting empty stomachs with empty tables by giving discounts on meals in the restaurants registered with them. Eatigo has successfully has partnered with more than a million diners. Way to go!,"With a sole aim of connecting empty stomachs with empty tables by giving discounts on meals in the restaurants registered with them. Eatigo has successfully has partnered with more than a million diners. Way to go! Discount, dining, Million, serves large.",7,2,6,12,Health
startup_3ae62eea4d3,"Noticeboard is focused on leveraging the power of the mobile phone to make information more accessible, and will be looking for top talent that understands the nuances of the small screen deeply. It aims making organisational communication more inclusive.","Noticeboard is focused on leveraging the power of the mobile phone to make information more accessible, and will be looking for top talent that understands the nuances of the small screen deeply. It aims making organisational communication more inclusive. Mobile, cellphone, small screen, organisation.",8,4,9,14,Investments
startup_3b9515728be,"Koinex is India's most advanced digital assets exchange. Buy, sell and trade in the world's fastest growing assets: cryprocurrencies and tokens.","Koinex is India's most advanced digital assets exchange. Buy, sell and trade in the world's fastest growing assets: cryprocurrencies and tokens. ",5,7,4,13,Gaming
startup_3bcb7c56f87,"Innov8 is an ambitious project to house 100 entrepreneurs & help them build their vision & create impactful startups from the National Soil

","Innov8 is an ambitious project to house 100 entrepreneurs & help them build their vision & create impactful startups from the National Soil

",7,5,5,13,Software designers
startup_3d04d4656c3,Want to meet your doctor but are too sick to get out of bed? Doctor Insta is at your service. Video Call or chat with a doctor to get an advice on your health!,Want to meet your doctor but are too sick to get out of bed? Doctor Insta is at your service. Video Call or chat with a doctor to get an advice on your health!,7,7,6,15,Housing
startup_3eeca45bc90,Finding a right insurance is like finding a right partner for yourself. AskArvi has done a great job in automating this system letting people find a perfect plan from their phones itself! This idea definitely makes them one of the best startups in India,Finding a right insurance is like finding a right partner for yourself. AskArvi has done a great job in automating this system letting people find a perfect plan from their phones itself! This idea definitely makes them one of the best startups in India,4,4,7,11,Factoring
startup_3fe1ea0b539,A startups biggest challenge is to train its employees. HandyTrain trains them for you from your employees phones! Simple and smart right?,A startups biggest challenge is to train its employees. HandyTrain trains them for you from your employees phones! Simple and smart right?,4,5,4,12,Creditors
startup_437d869e0b3,"GoCoop.com is a internet-based global platform which provides value-added business services for co-ops and self-help groups to enable communication and collaboration with their members, marketing their products and services and leverage information technology to improve their operations.","GoCoop.com is a internet-based global platform which provides value-added business services for co-ops and self-help groups to enable communication and collaboration with their members, marketing their products and services and leverage information technology to improve their operations.",4,4,4,14,Transportation
startup_4b23e056fd9,"iNurture Education Solutions Pvt. Ltd. delivers industry relevant courses at undergraduate and postgraduate levels in the fast growing sectors of the economy, in active association with well-reputed universities and autonomous institutions/ colleges.","iNurture Education Solutions Pvt. Ltd. delivers industry relevant courses at undergraduate and postgraduate levels in the fast growing sectors of the economy, in active association with well-reputed universities and autonomous institutions/ colleges.",6,7,7,14,Beauty
startup_501347dae2a,"OpenOut is a trusted community of people, hosts and guests, where you can create, explore or become a part of unique at-home social experiences.","OpenOut is a trusted community of people, hosts and guests, where you can create, explore or become a part of unique at-home social experiences.",7,7,6,10,News
startup_514b7e9f6e6,"Gaming turning into money-making! Yes, you read it right.HalaPlay can let you live in the fantasy world and win cash prizes at the end of every game making it among the best startups in India.","Gaming turning into money-making! Yes, you read it right.HalaPlay can let you live in the fantasy world and win cash prizes at the end of every game making it among the best startups in India.",7,8,8,11,Messaging
startup_5349d6c5e0c,Sequretek intends to secure and manage the customers information assets so that they are better equipped to handle the changing digital landscape and service needs that lead to their organizational growth. It aims on being its customers 'Trusted Advisor' for their problems,Sequretek intends to secure and manage the customers information assets so that they are better equipped to handle the changing digital landscape and service needs that lead to their organizational growth. It aims on being its customers 'Trusted Advisor' for their problems,9,8,8,9,Trip planners
startup_5377381aa1e,"Imagine knowing your money status with the help of your SMS-es, Money View shows your account details by accessing your bank messages and showing your balance!

","Imagine knowing your money status with the help of your SMS-es, Money View shows your account details by accessing your bank messages and showing your balance!

",5,4,5,13,Budget planner
startup_54e691b2e0e,"In the age of technology, Active.ai makes it possible giving a beautiful human touch to Conversational Banking Services. They have made it possible to make conversations less robotic and consumer oriented making the doubt solving process more simpler!","In the age of technology, Active.ai makes it possible giving a beautiful human touch to Conversational Banking Services. They have made it possible to make conversations less robotic and consumer oriented making the doubt solving process more simpler!",3,2,6,9,Fitness
startup_565a20e6211,"In the business city of Bangalore, CoWrks is a unique concept providing many working individuals to come and rent working spaces for themselves. Pssstt.. they have an amazing interior worth being listed as one of the top startups in India!","In the business city of Bangalore, CoWrks is a unique concept providing many working individuals to come and rent working spaces for themselves. Pssstt.. they have an amazing interior worth being listed as one of the top startups in India!",7,5,5,13,Leasing
startup_58ea6d8b492,Want your employees salaries increased without any change in your share? NiYo can give you a solution! Redefine Payroll & benefits and give your employees upto 10% Pay raise.,Want your employees salaries increased without any change in your share? NiYo can give you a solution! Redefine Payroll & benefits and give your employees upto 10% Pay raise.,7,5,7,13,Furnitures
startup_626fc93dc6a,Imagine how fun it would be learning via games and stories? Chimple is doing the same! This Bangalore based organisation believes that education is for all is doing everything to achieve their goal.,Imagine how fun it would be learning via games and stories? Chimple is doing the same! This Bangalore based organisation believes that education is for all is doing everything to achieve their goal.,7,3,5,10,Digital payment
startup_6ac1261a446,How great would it be if you could increase your work out speed and also track your progress? Kishore duo has made it possible my merging fitness with technology to make lives healthier for all and successfully made into the list of one of the best startups in India!,How great would it be if you could increase your work out speed and also track your progress? Kishore duo has made it possible my merging fitness with technology to make lives healthier for all and successfully made into the list of one of the best startups in India!,8,5,8,11,Washing
startup_6dcc97cbf7bf,"Bringing alive the classic poker on-screen, 9Stacks is a unique concept binding all the Poker lovers together under one roof to start the game with 9 stacks of poker chips!","Bringing alive the classic poker on-screen, 9Stacks is a unique concept binding all the Poker lovers together under one roof to start the game with 9 stacks of poker chips!",4,3,4,5,NBFC
startup_6eb76f323c3,"Weaving magic with words, Terribly Tiny Tales is a forum for story enthusiasts and making a community of word lovers!","Weaving magic with words, Terribly Tiny Tales is a forum for story enthusiasts and making a community of word lovers!",4,4,4,13,Servicing
startup_7213abde43e,"Being a God-sent application for Bangalore-ians and Pune-kars, Dunzo runs errands for its users. Be it repairing your sink or sending a parcel off, you can just Dunzo-it! Waiting for it for available nationwide! But whatever it is, they surely deserve to be one of the best startups in India

","Being a God-sent application for Bangalore-ians and Pune-kars, Dunzo runs errands for its users. Be it repairing your sink or sending a parcel off, you can just Dunzo-it! Waiting for it for available nationwide! But whatever it is, they surely deserve to be one of the best startups in India

",8,5,6,12,Banking
startup_75f2cebe20e,CallHealth is a technology-powered healthcare company that brings healthcare services to the doorstep of the customer. Definitely worth being as one of the best startups in India.,CallHealth is a technology-powered healthcare company that brings healthcare services to the doorstep of the customer. Definitely worth being as one of the best startups in India.,4,4,6,16,Consultancy
startup_795e8d2f1bd,"Seeing Fashion online, Fynd is dedicated to make its users chic and sexy!","Seeing Fashion online, Fynd is dedicated to make its users chic and sexy!",5,4,6,12,Education
startup_7d25b37d798,"With clients like Ola, PayTM, MobiKwick, ClearTrip and many more, Hansel.io is a trusted name in deep-config APIs. Delivering what they promise, Hansel.io is an expert in providing personalized experience for all its client base!","With clients like Ola, PayTM, MobiKwick, ClearTrip and many more, Hansel.io is a trusted name in deep-config APIs. Delivering what they promise, Hansel.io is an expert in providing personalized experience for all its client base!",9,9,7,14,Investments
startup_7e7e947b210,"Building a home has never been easier, thanks to Homergize! Homergize is a One-Stop Shop for purchasing Materials & Products ranging from Building Materials to Fittings to Furnishings.","Building a home has never been easier, thanks to Homergize! Homergize is a One-Stop Shop for purchasing Materials & Products ranging from Building Materials to Fittings to Furnishings.",5,3,4,15,Gaming
startup_80e57982848,"Targeting India's most favorite food Biryani, this company has reached in the veins of maximum people. Biryani by Kilo does what the name suggests, sends happiness parceled and is perfect for any occasion. Guess what? It a rating of 4.0 on Zomato. Yummy idea!","Targeting India's most favorite food Biryani, this company has reached in the veins of maximum people. Biryani by Kilo does what the name suggests, sends happiness parceled and is perfect for any occasion. Guess what? It a rating of 4.0 on Zomato. Yummy idea!",6,6,5,8,VR
startup_84dee75e130,"Made for Indian men, Mr Button was an idea to make Indian men fashionable and presentable!","Made for Indian men, Mr Button was an idea to make Indian men fashionable and presentable!",7,9,8,10,Education
startup_8559eb7766c,"Love travelling? GoFro should be your best friend! Started to empower the modern traveler with flexibility of choices and a fulfilling sense of independence, GoFro is doing a splendid job!","Love travelling? GoFro should be your best friend! Started to empower the modern traveler with flexibility of choices and a fulfilling sense of independence, GoFro is doing a splendid job!",7,5,8,11,Health
startup_88d64d63101,Graphic India is nations very well known animation creator. Want to see their recent work? Watch ñBaahubali: The Lost Legendsî on Amazon Prime and get amazed and you'll know why they are among the best startups in India.,Graphic India is nations very well known animation creator. Want to see their recent work? Watch ñBaahubali: The Lost Legendsî on Amazon Prime and get amazed and you'll know why they are among the best startups in India.,5,5,7,10,Investments
startup_88e4ee56611,"Manage your cash flows with this useful app, Numberz!, Wallet, Banking","Manage your cash flows with this useful app, Numberz!, Wallet, Banking",5,3,8,12,Software designers
startup_8a7cc648a7f,What if we tell you that you can monitor your body's clinical vitals from a device? Startup ten3T made this possible. Their invention of a wearable monitoring device for your dear body which can help you make healthier decisions!,What if we tell you that you can monitor your body's clinical vitals from a device? Startup ten3T made this possible. Their invention of a wearable monitoring device for your dear body which can help you make healthier decisions!,4,8,4,13,Movers and takers
startup_8e5018e725e,Providing end - to - end logistics in an 'express' way Ecom Express has established itself as one of the trusted and reliable names in delivery services to e-commerce industry and also one of the best startups in India,Providing end - to - end logistics in an 'express' way Ecom Express has established itself as one of the trusted and reliable names in delivery services to e-commerce industry and also one of the best startups in India,9,9,6,6,Consultancy
startup_8e6bb85c120,"Future Educators like AEON Learning are blessing for working professionals. With the help of technology, they provide degrees in various management courses from prestigious universities. Giving e-learning a new look!","Future Educators like AEON Learning are blessing for working professionals. With the help of technology, they provide degrees in various management courses from prestigious universities. Giving e-learning a new look!",5,5,6,9,Factoring
startup_8e99c7d48a7,Have a luxury travel with icanstay and enjoy traveling first - class! Providing first class travel making them reach the destination of one of the best startup in India,Have a luxury travel with icanstay and enjoy traveling first - class! Providing first class travel making them reach the destination of one of the best startup in India,7,6,5,10,News
startup_8ed3e2b3e68,"Clip - an Android application makes it a breeze to create, watch and download funny Indian videos. With 1,000,000+ users it is one app you should have!","Clip - an Android application makes it a breeze to create, watch and download funny Indian videos. With 1,000,000+ users it is one app you should have!",4,4,4,13,Food
startup_905ba8f9dfb,"Aiding global e-commerce and retail services for their monetary transactions, airpay aims in simplifying the process of transaction much more smoother and flexible.","Aiding global e-commerce and retail services for their monetary transactions, airpay aims in simplifying the process of transaction much more smoother and flexible.",8,7,9,12,Ecommerce
startup_9099f229c0a,"SigTuple aim to create a data driven, machine learned, cloud based solution for detection of anomalies and trends in medical data, which improves the accuracy and efficiency of disease diagnosis.","SigTuple aim to create a data driven, machine learned, cloud based solution for detection of anomalies and trends in medical data, which improves the accuracy and efficiency of disease diagnosis.",6,6,6,11,Blockchain
startup_93b9136fc9d,"Shifu creates an innovative and immersive learning experience during play time by bringing board games and mobile devices together through Augmented Reality. Because they believe, children deserve good screen time.","Shifu creates an innovative and immersive learning experience during play time by bringing board games and mobile devices together through Augmented Reality. Because they believe, children deserve good screen time.",6,5,9,13,Food catering
startup_9857eb86264,"Little Black Book complies the best spots/eateries of your cities which you might never have discovered! Started with Delhi, this Little Black Book is worth the read!","Little Black Book complies the best spots/eateries of your cities which you might never have discovered! Started with Delhi, this Little Black Book is worth the read!",9,8,7,16,Entertainment
startup_98b25c82dfc,"One of the pioneers of comedy in India, EIC has surely left a mark on people's minds and makes everyone laugh very hard with their sarcastic takes on real-time situations. Very 'SAARAAS' job guys! Haaste haasate you finally got on the list of Top Startups in India","One of the pioneers of comedy in India, EIC has surely left a mark on people's minds and makes everyone laugh very hard with their sarcastic takes on real-time situations. Very 'SAARAAS' job guys! Haaste haasate you finally got on the list of Top Startups in India",9,7,8,13,Banking
startup_9a4c9975a12,Do you have a vehicle lying just at a disposal? Turn it into an earning member with Drivezy and thank me later for including them among the top startups in India!,Do you have a vehicle lying just at a disposal? Turn it into an earning member with Drivezy and thank me later for including them among the top startups in India!,9,9,7,10,Consultancy
startup_9d66062929b,"With 1,20,000+ subscribers, Flintobox has aims on holistic education of children. Delivering happiness in a box, Flintobox curates a new theme every month and helps in the growth of the child. If you are a parent, this is worth a try!","With 1,20,000+ subscribers, Flintobox has aims on holistic education of children. Delivering happiness in a box, Flintobox curates a new theme every month and helps in the growth of the child. If you are a parent, this is worth a try!",6,8,5,13,Interior decorators
startup_a5b7068f910,"Giving Best Price commitment, Sendd will give you complete shipping solution
for your Business from pick to drop at any pincode in India.","Giving Best Price commitment, Sendd will give you complete shipping solution
for your Business from pick to drop at any pincode in India.",4,4,6,15,Wedding planners
startup_aab4679508c,"SlicePay is a digital payment platform which was founded with a mission to simplify payments for the young. With changing times, they strive to make payments smarter and simpler.","SlicePay is a digital payment platform which was founded with a mission to simplify payments for the young. With changing times, they strive to make payments smarter and simpler.",4,8,9,13,VR
startup_ae6a02c524d,We know how much of a limited pocket money does a student get and KrazyBee is a wonderful option for students to buy electronics on EMI,We know how much of a limited pocket money does a student get and KrazyBee is a wonderful option for students to buy electronics on EMI,5,5,5,12,Education
startup_af2263cee85,Being the bridge between investors and borrowers Credy is one of its kind and totally one of the best startups in India!,Being the bridge between investors and borrowers Credy is one of its kind and totally one of the best startups in India!,6,2,4,11,Movers and takers
startup_b081e59cc05,Have a car to be insured or want to insure the health of yourself or your family? Visit RenewBuy and do the needful in few minutes without any middleman in between!,Have a car to be insured or want to insure the health of yourself or your family? Visit RenewBuy and do the needful in few minutes without any middleman in between!,7,2,6,12,Health
