startup_b2a9b391d75,Often companies do not have enough data to train a machine learning model on their own using state of the art algorithms as well as don't have enough data scientists to work on those problems. NanoNets solves both these problems for companies. NanoNets is machine learning API for developers which requires 1/10th of data and no machine learning expertise to train a model.,Often companies do not have enough data to train a machine learning model on their own using state of the art algorithms as well as don't have enough data scientists to work on those problems. NanoNets solves both these problems for companies. NanoNets is machine learning API for developers which requires 1/10th of data and no machine learning expertise to train a model.,8,4,9,14,Investments
startup_b2c19bea700,"It is home furniture, appliances and a lot of love that make a home - a house. Rentickle helps to rent furniture and home essentials with options of various brands to choose from.","It is home furniture, appliances and a lot of love that make a home - a house. Rentickle helps to rent furniture and home essentials with options of various brands to choose from.",5,7,4,13,Gaming
startup_b59a5b8ce10,"Stories always hold a special place in one hearts. Using this concept, Josh Talks uses words to inspire everyone wanting to be motivated!","Stories always hold a special place in one hearts. Using this concept, Josh Talks uses words to inspire everyone wanting to be motivated!",7,5,5,13,Software designers
startup_b9590350041,"Live in Delhi and own a car? Who would know better than you how difficult it is to find a parking spot! Get My Parking comes to your rescue. Use this app to find an available a spot in Delhi. Rest of the nation has to wait while Delhi-ites have all the perks of this app! If Delhi loves it, how can't this company be one of best startups in India.","Live in Delhi and own a car? Who would know better than you how difficult it is to find a parking spot! Get My Parking comes to your rescue. Use this app to find an available a spot in Delhi. Rest of the nation has to wait while Delhi-ites have all the perks of this app! If Delhi loves it, how can't this company be one of best startups in India.",7,7,6,15,Housing
startup_ba43cb76899,ERA is India's first integrated identity platform which provides it's users a safe and secure way to share their Identities with the world.,ERA is India's first integrated identity platform which provides it's users a safe and secure way to share their Identities with the world.,4,4,7,11,Factoring
startup_ba8323c622b,"Flochat is one of it's kind combining apps like Ola, Zomato and many more under one platform. Download this and enjoy the joy of surfing so many apps from one!","Flochat is one of it's kind combining apps like Ola, Zomato and many more under one platform. Download this and enjoy the joy of surfing so many apps from one!",4,5,4,12,Creditors
startup_cc81205365c,"Funded by one of the Nation's stylist diva - Alia Bhatt, StyleCracker - IndiaÍs first online personal styling portal understands the importance of great style in day-to-day life.","Funded by one of the Nation's stylist diva - Alia Bhatt, StyleCracker - IndiaÍs first online personal styling portal understands the importance of great style in day-to-day life.",4,4,4,14,Transportation
startup_ccdee3e72f2,"As the name suggests, this website wants to provide end - to - end health management to their consumers","As the name suggests, this website wants to provide end - to - end health management to their consumers",6,7,7,14,Beauty
startup_cd15bb7049b,"This Delhi based startup is giving wings to upcoming startups in form of monetary help. The best part? They just give funding just in 3 days! Delhi-ites with an idea, are you listening?","This Delhi based startup is giving wings to upcoming startups in form of monetary help. The best part? They just give funding just in 3 days! Delhi-ites with an idea, are you listening?",7,7,6,10,News
startup_cd96a563a60,"Flock is a faster, more organized way for teams to communicate. Flock powers over 25,000 companies and its users around the world have reported increased productivity by 30%, 50% fewer emails, and a 50% reduction in in-person meetings.Their clients include Accenture, Tim Hortons, Whirlpool, VMware and Victorinox.","Flock is a faster, more organized way for teams to communicate. Flock powers over 25,000 companies and its users around the world have reported increased productivity by 30%, 50% fewer emails, and a 50% reduction in in-person meetings.Their clients include Accenture, Tim Hortons, Whirlpool, VMware and Victorinox.",7,8,8,11,Messaging
startup_cf892e16246,"Fella Homes is a branded chain of rental homes. Being synonymous with hassle-free and quality living, they aim to standardize the entire experience of finding and living in a rented home with the use of technology enabled product and services.","Fella Homes is a branded chain of rental homes. Being synonymous with hassle-free and quality living, they aim to standardize the entire experience of finding and living in a rented home with the use of technology enabled product and services.",9,8,8,9,Trip planners
startup_d138e6a27ec,"Standing by its name, LetsTransport provides end-to-end logistic support with advantage of GPS tracking and advance booking only for you!","Standing by its name, LetsTransport provides end-to-end logistic support with advantage of GPS tracking and advance booking only for you!",5,4,5,13,Ecommerce
startup_d230c1ec050,"An EdTech start up, Avishkaar Box stands by its name. They create mind stimulating products enabling young students to spark up their minds and double their imagination. Their invention Robby and Robby 2 are mind boggling!","An EdTech start up, Avishkaar Box stands by its name. They create mind stimulating products enabling young students to spark up their minds and double their imagination. Their invention Robby and Robby 2 are mind boggling!",3,2,6,9,Blockchain
startup_d449f779505,Stanza is a unique housing concept created for students moving to a new place and wanting to create a space for themselves.,Stanza is a unique housing concept created for students moving to a new place and wanting to create a space for themselves.,7,5,5,13,Food catering
startup_d775ae66135,"As your end-to-end automation solutions partner, TAOautomation will work with you to develop your automation strategy, be it basic RPA or more advanced cognitive and machine learning solutions, to implement it swiftly and closely manage the entire change programme.","As your end-to-end automation solutions partner, TAOautomation will work with you to develop your automation strategy, be it basic RPA or more advanced cognitive and machine learning solutions, to implement it swiftly and closely manage the entire change programme.",7,5,7,13,Entertainment
startup_db108287d8c,"Catering to on-demand entertainment, ALTBalaji is doing a splendid job! From its gripping original series to the wide range of shows and movies, ALTBalaji is really worth of your attention and a tough competition for many and deserves a place as one of the Top Startups in India.","Catering to on-demand entertainment, ALTBalaji is doing a splendid job! From its gripping original series to the wide range of shows and movies, ALTBalaji is really worth of your attention and a tough competition for many and deserves a place as one of the Top Startups in India.",7,3,5,10,Banking
startup_e21987a5713,"Storeking is a revolutionary platform enabling small town Retailers to sell over 50,000 products to walk-in customers without having to invest in working capital stock.","Storeking is a revolutionary platform enabling small town Retailers to sell over 50,000 products to walk-in customers without having to invest in working capital stock.",8,5,8,11,Consultancy
startup_ec4d8c5e4dc,Empowering kirana-wala's to multi-nationals m.Paani helps in Sales Conversion to Brand Loyalty Services for its consumers right from their mobiles!,Empowering kirana-wala's to multi-nationals m.Paani helps in Sales Conversion to Brand Loyalty Services for its consumers right from their mobiles!,4,3,4,5,Interior decorators
startup_ed65481df1f,"Meesho is India's Largest Online Reseller Network of Housewives & SMBs, who sell products within their network on social channels.","Meesho is India's Largest Online Reseller Network of Housewives & SMBs, who sell products within their network on social channels.",4,4,4,13,Wedding planners
startup_eeac0eb99d6,"GamingMonk is a heaven for gamers, from organizes offline gaming tournaments for sports, strategy, and action e-games to be played on Xbox, personal computer, mobile, and PlayStation 4. It also retails gaming accessories, consoles, and software. Users can form their own communities and get lost in the fantasy world of their own.","GamingMonk is a heaven for gamers, from organizes offline gaming tournaments for sports, strategy, and action e-games to be played on Xbox, personal computer, mobile, and PlayStation 4. It also retails gaming accessories, consoles, and software. Users can form their own communities and get lost in the fantasy world of their own.",8,5,6,12,VR
startup_efb616698b9,SensiBol was founded by like-minded audio-technology researchers and computer-scientists with a mission to deliver cutting-edge audio-processing solutions to the world.,SensiBol was founded by like-minded audio-technology researchers and computer-scientists with a mission to deliver cutting-edge audio-processing solutions to the world.,4,4,6,16,Education
startup_f2e9ae74054,People dread shifting due to the hassle of taking the belongings from one place to another. That is when Blowhorn thought to help them and made their place in one of the Top Startups in India. Blowhorn offers a better and a safe option for people looking to move their belongings from one place to another!,People dread shifting due to the hassle of taking the belongings from one place to another. That is when Blowhorn thought to help them and made their place in one of the Top Startups in India. Blowhorn offers a better and a safe option for people looking to move their belongings from one place to another!,5,4,6,12,Movers and takers
startup_f82fa6e6ecb,An amazing startup portal giving users loans in easy ways!,An amazing startup portal giving users loans in easy ways!,9,9,7,14,Health
startup_faf60db1c6f,Gone are the days when owning a farm was a huge investment! Gold Farm lets you rent farming equipment and make lives simpler for all! What makes life good surely is among the best startups in India.,Gone are the days when owning a farm was a huge investment! Gold Farm lets you rent farming equipment and make lives simpler for all! What makes life good surely is among the best startups in India.,5,3,4,15,Investments
startup_fb1bebdd5d6,"PropStory is a content platform for the real estate industry. The organization has been floated by professionals with several years of experience in Real Estate investing, private banking, and internet technology.","PropStory is a content platform for the real estate industry. The organization has been floated by professionals with several years of experience in Real Estate investing, private banking, and internet technology.",6,6,5,8,Gaming
